{
  "schema_version": "2.0.0",
  "kind": "DiagnosticReport",
  "packet_id": "sp_75ca8726467e4fcffe5f9d94",
  "identity": {
    "target_id": "2pqw_A__2rhy_MLZ",
    "ligand_id": "ligand_001",
    "stage": "t_0.75",
    "stage_t": 0.75
  },
  "assessment": "risks_observed",
  "summary": "1 endpoint risk regions; 2 raw-state groups; 4 coverage root causes.",
  "findings": [
    {
      "finding_id": "risk_2d49cf0c4744da1b",
      "category": "structural_screening",
      "scope": "predicted_endpoint",
      "priority": "contextual",
      "views": [
        "prediction",
        "sdf"
      ],
      "atom_ids": [
        2,
        3,
        8
      ],
      "chemical_context": {
        "atoms": [
          {
            "atom_id": 2,
            "element": "C",
            "formal_charge": 0,
            "declared_bond_order_sum": 4.0,
            "implicit_hydrogens": 0,
            "total_valence": 4,
            "hybridization": "SP2",
            "atomics_top3": [
              {
                "category": "C",
                "probability": 0.9997310042381287
              },
              {
                "category": "N",
                "probability": 0.00022141872614156455
              },
              {
                "category": "S",
                "probability": 2.7184174541616812e-05
              }
            ],
            "charges_top3": [
              {
                "category": 0,
                "probability": 0.9998385906219482
              },
              {
                "category": 1,
                "probability": 0.00015864695888012648
              },
              {
                "category": -1,
                "probability": 2.522981503716437e-06
              }
            ]
          },
          {
            "atom_id": 3,
            "element": "N",
            "formal_charge": 0,
            "declared_bond_order_sum": 2.0,
            "implicit_hydrogens": 1,
            "total_valence": 3,
            "hybridization": "SP2",
            "atomics_top3": [
              {
                "category": "N",
                "probability": 0.9945185780525208
              },
              {
                "category": "O",
                "probability": 0.002865426242351532
              },
              {
                "category": "C",
                "probability": 0.0022893629502505064
              }
            ],
            "charges_top3": [
              {
                "category": 0,
                "probability": 0.8783462643623352
              },
              {
                "category": 1,
                "probability": 0.12152700871229172
              },
              {
                "category": -1,
                "probability": 0.00011878492659889162
              }
            ]
          },
          {
            "atom_id": 8,
            "element": "N",
            "formal_charge": 0,
            "declared_bond_order_sum": 3.0,
            "implicit_hydrogens": 0,
            "total_valence": 3,
            "hybridization": "SP2",
            "atomics_top3": [
              {
                "category": "N",
                "probability": 0.9974777102470398
              },
              {
                "category": "C",
                "probability": 0.0020658087451010942
              },
              {
                "category": "S",
                "probability": 0.000243773014517501
              }
            ],
            "charges_top3": [
              {
                "category": 0,
                "probability": 0.9935094714164734
              },
              {
                "category": 1,
                "probability": 0.006486290600150824
              },
              {
                "category": -1,
                "probability": 4.123432518099435e-06
              }
            ]
          }
        ],
        "bonds": [
          {
            "atom_ids": [
              2,
              3
            ],
            "bond_order": 1.0,
            "distance_angstrom": 1.3510350948191534,
            "top3": [
              {
                "category": 1,
                "probability": 0.9837502837181091
              },
              {
                "category": 2,
                "probability": 0.01545730046927929
              },
              {
                "category": 0,
                "probability": 0.0007924094097688794
              }
            ]
          },
          {
            "atom_ids": [
              2,
              8
            ],
            "bond_order": 2.0,
            "distance_angstrom": 1.3210012899012,
            "top3": [
              {
                "category": 2,
                "probability": 0.8806218504905701
              },
              {
                "category": 1,
                "probability": 0.11931112408638
              },
              {
                "category": 0,
                "probability": 6.682673119939864e-05
              }
            ]
          },
          {
            "atom_ids": [
              3,
              8
            ],
            "bond_order": 0.0,
            "distance_angstrom": 2.363239249918258,
            "top3": [
              {
                "category": 0,
                "probability": 0.9997270703315735
              },
              {
                "category": 1,
                "probability": 0.00023561403213534504
              },
              {
                "category": 2,
                "probability": 3.734349593287334e-05
              }
            ]
          }
        ],
        "source_metric": {
          "view": "prediction",
          "metric_id": "chemistry_context"
        }
      },
      "primary_evidence_ids": [
        "ev_5c322e469c8e8af683f2",
        "ev_1b7dcd8ca42617633597",
        "ev_8d4e0c0c3e6e3b35e33d",
        "ev_7371d4d57daf9b52db96"
      ],
      "supporting_evidence_ids": [],
      "evidence_ids": [
        "ev_5c322e469c8e8af683f2",
        "ev_1b7dcd8ca42617633597",
        "ev_8d4e0c0c3e6e3b35e33d",
        "ev_7371d4d57daf9b52db96"
      ],
      "representative_evidence_ids": [
        "ev_5c322e469c8e8af683f2",
        "ev_1b7dcd8ca42617633597"
      ],
      "unique_primary_observation_count": 2,
      "source_observation_count": 4,
      "trajectory": {
        "previous_t": 0.5,
        "atom_changes": [
          {
            "atom_id": 3,
            "previous_element": "C",
            "element": "N",
            "previous_charge": 0,
            "formal_charge": 0
          },
          {
            "atom_id": 8,
            "previous_element": "C",
            "element": "N",
            "previous_charge": 0,
            "formal_charge": 0
          }
        ],
        "bond_changes": [
          {
            "atom_ids": [
              2,
              8
            ],
            "previous_order": 1.0,
            "bond_order": 2.0
          }
        ],
        "interpretation": "Local chemical identity changed; do not claim persistence of the same chemical constraint."
      },
      "molecule_context": [
        {
          "view": "prediction",
          "metric_id": "valence",
          "status": "ok",
          "values": {
            "sanitized": true
          },
          "thresholds": {}
        },
        {
          "view": "prediction",
          "metric_id": "mmff_strain",
          "status": "ok",
          "values": {
            "strain_proxy_kcal_mol": 5.977272316513776,
            "hydrogen_relaxation_status": 0,
            "minimization_status": 0
          },
          "thresholds": {
            "screening_strain_kcal_mol": 20.0
          }
        },
        {
          "view": "prediction",
          "metric_id": "posebusters",
          "status": "ok",
          "values": {
            "all_reported_checks_pass": true
          },
          "thresholds": {}
        }
      ],
      "calibrated_probability": null,
      "interpretation_limit": "Current-state measurements do not establish final persistence. MMFF and substructure references are screening models, not experimental chemical feasibility. Global energy and PoseBusters findings are molecule-level support, not localized energy attribution."
    }
  ],
  "raw_state_findings": [
    {
      "finding_id": "risk_d7607ec53324f3ad",
      "category": "raw_graph_validity",
      "scope": "observed_noisy_state",
      "priority": "high",
      "views": [
        "state"
      ],
      "atom_ids": [
        1,
        3,
        4,
        6
      ],
      "chemical_context": {
        "atoms": [
          {
            "atom_id": 1,
            "element": "C",
            "formal_charge": 0,
            "declared_bond_order_sum": 5.5,
            "atomics_top3": [
              {
                "category": "C",
                "probability": 1.0
              },
              {
                "category": "I",
                "probability": 0.0
              },
              {
                "category": "Bi",
                "probability": 0.0
              }
            ],
            "charges_top3": [
              {
                "category": 0,
                "probability": 1.0
              },
              {
                "category": -3,
                "probability": 0.0
              },
              {
                "category": -1,
                "probability": 0.0
              }
            ]
          },
          {
            "atom_id": 3,
            "element": "N",
            "formal_charge": null,
            "declared_bond_order_sum": 4.5,
            "atomics_top3": [
              {
                "category": "N",
                "probability": 1.0
              },
              {
                "category": "I",
                "probability": 0.0
              },
              {
                "category": "Bi",
                "probability": 0.0
              }
            ],
            "charges_top3": [
              {